{
  "schema_version": 1,
  "narration_id": "narration_demo_complete",
  "conversation_id": "chat_demo",
  "task_id": "task_demo_voice_docs",
  "source_event_id": "event_task_completed",
  "kind": "completion",
  "priority": "high",
  "speech_policy": "when_idle",
  "visual_summary": "The architecture documentation passed schema, diagram, link, and privacy validation.",
  "speakable_facts": [
    "The architecture documentation is complete.",
    "The schemas, diagrams, links, and privacy checks passed."
  ],
  "suggested_utterance": "The architecture package is complete, and its schemas, diagrams, links, and privacy checks all passed.",
  "dedupe_key": "task_demo_voice_docs:completion",
  "expires_at": null,
  "contains_sensitive_detail": false,
  "created_at": "2026-08-02T12:30:00Z"
}
